{
  "$schema": "lexical-diversity-contract.schema.json",
  "contract_id": "ldfreq-lexical-diversity-core",
  "contract_version": "0.2.0",
  "status": "normative",
  "reviewed_on": "2026-10-24",
  "normative": true,
  "normative_authority": "This contract and its hand fixtures are authoritative for the twelve-method core; no Python, R, Java, Web, koRpus, or quanteda implementation is the sole oracle.",
  "input_contract": {
    "unit": "one document represented as an ordered sequence of already-tokenized Unicode strings",
    "order": "preserve input token order exactly",
    "normalization": "none in the metric core",
    "type_equivalence": "exact equality of Unicode scalar sequences; canonically equivalent spellings are distinct unless an identified adapter normalized them before entry",
    "missing_token_policy": "reject the document as invalid_input; do not silently drop NA",
    "empty_token_policy": "reject the document as invalid_input; a zero-length vector is an empty document, not an empty token",
    "encoding_policy": "tokens are already-decoded Unicode scalar sequences; reject ambiguous or ill-formed byte input, and do not treat differences in runtime encoding representation as type differences",
    "binding_profiles": {
      "r": {
        "representation": "plain, unclassed, one-dimensional character vector",
        "rejected_encoding_markers": [
          "bytes",
          "latin1"
        ],
        "unknown_marker_policy": "after validUTF8 succeeds, interpret non-ASCII bytes with an unknown marker as UTF-8 and mark a local copy as UTF-8 before equality/counting",
        "mutation": "do not mutate the caller's vector",
        "normalization": "encoding-marker canonicalization only; do not perform Unicode normalization"
      }
    },
    "raw_text_adapter": "separate and versioned; no raw-text adapter is part of this normative pre-tokenized core",
    "count_symbols": {
      "N": "number of tokens",
      "V": "number of distinct exact token strings",
      "f_t": "frequency of type t",
      "V_m": "number of types occurring exactly m times",
      "M2": "sum_t(f_t^2), equivalently sum_m(m^2 * V_m)"
    }
  },
  "output_contract": {
    "result_fields": [
      "metric_id",
      "method_id",
      "metric_contract_id",
      "metric_contract_version",
      "result_schema_id",
      "result_schema_version",
      "value",
      "status",
      "missing_reason",
      "requested_parameters",
      "effective_parameters",
      "N",
      "V",
      "below_quality_floor",
      "diagnostics"
    ],
    "result_schema_id": "lexdiv-core-metric-result",
    "result_schema_version": "0.1.0",
    "batch_envelope": {
      "schema_id": "lexdiv-r-batch-result",
      "schema_version": "0.1.0",
      "envelope_fields": [
        "document_id",
        "batch_schema_id",
        "batch_schema_version"
      ],
      "composition": "envelope_fields followed by result_fields",
      "order": "input document order, then requested metric order"
    },
    "statuses": [
      "ok",
      "missing",
      "invalid_input"
    ],
    "missing_reasons": [
      "empty_input",
      "invalid_token",
      "insufficient_tokens_for_formula",
      "too_short_for_requested_parameter",
      "zero_denominator",
      "no_factor",
      "non_convergence",
      "boundary_censored",
      "unbounded_high"
    ],
    "missing_reason_precedence": [
      "invalid_token",
      "empty_input",
      "metric-specific domain reason"
    ],
    "request_validation_policy": "metric selection and parameters for every requested metric are structural API inputs and are validated before document-token state; parameters belonging only to unrequested metrics are ignored",
    "short_text_policy": "strict: never silently reduce a requested segment, window, draw, or fitting range to N",
    "parameter_reporting": "requested and effective parameters must both be emitted; for an ok result they are identical",
    "quality_floor_policy": "quality_floor_tokens is an advisory legacy screening flag, not a validated quality or reliability threshold. For TTR, 1 is only the non-empty computational domain. For MATTR, 50 is a fixed document-length screen motivated by context-specific 50-token-window evidence, not a validated rule for other windows. Neither passing the screen nor having many overlapping windows establishes precision. See lexdiv_length_evidence().",
    "floating_point": {
      "model": "IEEE-754 binary64",
      "intermediate_rounding": "none",
      "serialization": "at least 15 significant decimal digits",
      "fixture_absolute_tolerance": 1e-12,
      "fixture_relative_tolerance": 1e-12
    }
  },
  "r_profile_contract": {
    "scope": "optional R orchestration over the twelve normative core methods; it does not change a core metric result",
    "admitted_stability": [
      "stable",
      "experimental"
    ],
    "identity_model": {
      "metric_id": "construct or metric family",
      "method_id": "formula, scale, boundary, tail, and aggregation identity fixed by a metric contract entry",
      "specification_id": "method identity plus normalized user parameters and metric-contract identity",
      "request_id": "plan-local join label excluded from computational identity"
    },
    "specification": {
      "fields": [
        "request_id",
        "specification_id",
        "metric_id",
        "method_id",
        "parameters",
        "default_quality_floor_tokens",
        "identity_key"
      ],
      "normalization": "materialize every user-settable default in method-defined parameter order; store positive integer-valued scalar or vector parameters as canonical R integers when they do not exceed .Machine$integer.max and as finite doubles otherwise, while non-integer parameters remain finite binary64 numeric values",
      "identity_key_fields": [
        "metric_contract_id",
        "metric_contract_version",
        "method_id",
        "normalized_parameters"
      ],
      "identity_key_serialization": "metric_contract_id|metric_contract_version|method_id|parameter_text encoded as UTF-8 without a trailing newline",
      "parameter_serialization": "{} for no parameters; otherwise {name=%a;...} in method-defined order, where %a is R sprintf hexadecimal binary64 formatting and a vector is serialized as c(%a,%a,...) without spaces",
      "specification_id_algorithm": "metric_id followed by '-' and the lowercase MD5 hex digest of identity_key UTF-8 bytes",
      "hash_role": "deterministic reproducibility label, not authentication; request_id and default_quality_floor_tokens are excluded"
    },
    "request_plan": {
      "schema_id": "lexdiv-r-request-plan",
      "schema_version": "0.1.0",
      "fields": [
        "plan_schema_id",
        "plan_schema_version",
        "plan_md5",
        "presets",
        "specifications",
        "max_specs"
      ],
      "minimum_specifications": 1,
      "default_max_specs": 128,
      "maximum_input_candidates": 1024,
      "candidate_bound_policy": "reject the total preset, custom-specification, and expanded-grid candidate count above maximum_input_candidates before specification normalization",
      "expansion_order": "selected presets in request order, then custom specifications, then grids in request order and value order",
      "deduplication": "collapse equal identity_key values before execution; first occurrence wins and order is otherwise preserved",
      "request_id_policy": "after deduplication, replace a missing request_id with specification_id",
      "request_id_uniqueness": "distinct resolved specifications must have distinct request_id values",
      "hash_record": "one-based request_index|request_id|identity_key",
      "hash_input": "schema_id, schema_version, and the ordered hash records joined with LF, with one LF between each of the three parts and no trailing LF",
      "hash_algorithm": "lowercase MD5 hex digest of the hash_input UTF-8 bytes",
      "construction_metadata_identity": "presets and max_specs are retained construction metadata but are excluded from plan_md5; the resolved specifications, request IDs, and order are authoritative"
    },
    "grid_builder": {
      "schema_id": null,
      "dimensionality": "one user-settable method parameter per grid",
      "expansion": "one specification per supplied value in input order; no implicit Cartesian product",
      "default_max_values": 128,
      "bound_policy": "reject length(values) greater than max_values before specification expansion; max_values is a positive finite integer and must be raised explicitly by the caller",
      "deduplication": "deferred to request-plan normalization"
    },
    "presets": [
      {
        "preset_id": "canonical",
        "preset_version": "0.2.0",
        "specification_count": 11,
        "resolution": "one default specification per stable metric in contract order; experimental expected_ttr_d is supported only by explicit selection",
        "additions": []
      },
      {
        "preset_id": "length_50_100",
        "preset_version": "0.2.0",
        "specification_count": 13,
        "resolution": "canonical followed by the two additions in listed order",
        "additions": [
          {
            "request_id": "msttr_100",
            "metric_id": "msttr",
            "method_id": "msttr_nonoverlap_complete_drop_v1",
            "parameters": {
              "segment_length": 100
            }
          },
          {
            "request_id": "mattr_100",
            "metric_id": "mattr",
            "method_id": "mattr_sliding_step1_v1",
            "parameters": {
              "window_length": 100
            }
          }
        ]
      }
    ],
    "mtld_length_screen_policy": "50 and 100 tokens are quality or evidence screens, not MTLD estimation parameters; length_50_100 contains exactly one MTLD specification",
    "profile_envelope": {
      "schema_id": "lexdiv-r-profile-result",
      "schema_version": "0.1.0",